{
  "schemaVersion": "1.0.0",
  "generatedAt": "2026-02-08T01:07:27.649Z",
  "gitSha": "15066cc3ef6b65b46c3427c59cc92a1e4b56f66b",
  "environment": {
    "os": "darwin",
    "arch": "arm64",
    "bunVersion": "1.3.0",
    "runner": "local"
  },
  "policy": {
    "freshnessDays": 7,
    "versionScope": "latest-stable-only",
    "verificationScope": "macOS self-hosted verification only"
  },
  "clients": [
    {
      "name": "claude-code",
      "transport": "stdio",
      "protocolVersion": "2024-11-05",
      "status": "supported",
      "version": {
        "detected": "2.0.76",
        "source": "env"
      },
      "requiredScenarios": [
        {
          "id": "happy-path-handshake-tool",
          "name": "initialize + notifications/initialized + tools/list + tools/call + ping",
          "passed": true,
          "durationMs": 111.18
        },
        {
          "id": "strict-preinit-reject",
          "name": "strict rejects tools/list before initialize",
          "passed": true,
          "durationMs": 71.16
        },
        {
          "id": "validation-error-determinism",
          "name": "invalid tool args return structured VALIDATION_ERROR",
          "passed": true,
          "durationMs": 68.26
        },
        {
          "id": "unknown-method-mapping",
          "name": "unknown method maps to -32601",
          "passed": true,
          "durationMs": 67.37
        }
      ],
      "knownLimitations": [
        "None."
      ],
      "artifacts": {
        "transcriptsDir": "transcripts/claude-code",
        "logFile": "logs/claude-code.log"
      }
    },
    {
      "name": "cursor",
      "transport": "stdio",
      "protocolVersion": "2024-11-05",
      "status": "supported",
      "version": {
        "detected": "2.4.28",
        "source": "env"
      },
      "requiredScenarios": [
        {
          "id": "happy-path-handshake-tool",
          "name": "initialize + notifications/initialized + tools/list + tools/call + ping",
          "passed": true,
          "durationMs": 69.49
        },
        {
          "id": "strict-preinit-reject",
          "name": "strict rejects tools/list before initialize",
          "passed": true,
          "durationMs": 64.67
        },
        {
          "id": "validation-error-determinism",
          "name": "invalid tool args return structured VALIDATION_ERROR",
          "passed": true,
          "durationMs": 66.08
        },
        {
          "id": "unknown-method-mapping",
          "name": "unknown method maps to -32601",
          "passed": true,
          "durationMs": 71.14
        }
      ],
      "knownLimitations": [
        "None."
      ],
      "artifacts": {
        "transcriptsDir": "transcripts/cursor",
        "logFile": "logs/cursor.log"
      }
    }
  ],
  "summary": {
    "scenarioCount": 8,
    "failedScenarios": 0,
    "failureRate": 0,
    "allRequiredPassed": true,
    "mcpToolCallP95Ms": 111.18,
    "workerEventIngestP95Ms": 7.13
  },
  "slo": {
    "mcpToolCallP95TargetMs": 250,
    "workerEventIngestP95TargetMs": 100,
    "externalFailureRateTarget": 0.01,
    "met": true
  },
  "failureTaxonomy": [
    {
      "code": "CLIENT_PROTOCOL_DRIFT",
      "description": "Lifecycle or JSON-RPC behavior mismatch with claimed protocol contract.",
      "remediation": "Patch MCP compatibility handling, add/update transcript fixtures, rerun verification."
    },
    {
      "code": "WORKER_BRIDGE_REGRESSION",
      "description": "Platform worker bridge command/transport behavior mismatch.",
      "remediation": "Patch platform worker bridge implementation, rerun smoke checks, add targeted regression tests."
    },
    {
      "code": "ENVIRONMENT_DEPENDENCY",
      "description": "Client binary/version unavailable or runtime dependency missing on runner.",
      "remediation": "Fix runner provisioning/install scripts and pin verified client setup before re-running."
    },
    {
      "code": "NON_DETERMINISTIC_OUTPUT",
      "description": "Unstable output shape prevents deterministic verification.",
      "remediation": "Normalize volatile fields in harness output and tighten fixture assertions to stable keys."
    }
  ]
}
